Course,Term_Offerings,Campus,undergraduate_offered,postgraduate_offered,course_description,pre_requisites,course_uoc
LAWS8016,Term 3 2019,"Main Campus, Kensington",0,1,"This course has been designed to give postgraduate students an overview of intellectual property in the international context. It will cover some of the fundamental principles governing the international regulation of intellectual property, including a study of the content and operation of major international agreements. It will also explore the role of intellectual property as a tool of world trade and assess the dispute settlement procedures under the WTO TRIPS Agreement. In addition, it will assess the role and impact of global industry and non-governmental organisations in shaping intellectual property policy, as well as considering controversial issues such as the regulation of biotechnology, electronic commerce and the impact of intellectual property on the environment and human rights.
Main Topics
The international framework of intellectual property law: understanding relevant agreements and other instrumentsThe link between intellectual property and trade, development and human rightsWTO TRIPS jurisprudenceCurrent policy issues relating to international intellectual property",Prerequisite: Academic Program must be either 9200 or 9201 or 9231.,6 Units of Credit
LAWS8017,Term 1 2019,"Main Campus, Kensington",0,1,"This course is designed to give postgraduates a comprehensive overview and working understanding of intellectual property law. Assuming no prior knowledge of intellectual property, the course is suitable for students who wish to study intellectual property law for the first time, those who have studied intellectual property abroad and want to learn how it operates in Australia, and those who studied it some time ago and are seeking to update their knowledge of this fast-changing area of law.
Intellectual property is an important area of commercial legal practice and is vital to many industries. This course introduces students to the statutory provisions and common law relating to Australian intellectual property. For each topic, the course gives consideration to the subject matter that is protected, the preconditions for protection, and the nature of infringement. Other matters (such as remedies, competition law and international protection) may be dealt with briefly but are not examined in detail.
As far as possible in an intensive overview, this course focuses on the commercial and business aspects of intellectual property. By the end of the course, students should be able to identify copyright, trademark and passing off, designs and patent law issues, and make an informed decision about how to proceed in advising a client.
This course meets pre-requisite requirements for LAWS3057/JURD7357 Advanced Intellectual Property Policy and Practice, which is recommended for students who seek to further their knowledge of intellectual property policy issues and/or to deepen their skills applying intellectual property law in practice.
Main Topics
Introduction to Intellectual PropertyCopyright, including Moral RightsConfidential informations.18 Australian Consumer Law, formerly s.52 Trade Practices Act 1974)Passing offTrade marksDesignsPatents",Prerequisite: Academic Program must be 9200 or 9201 or 9231 or 9214.,6 Units of Credit
LAWS8020,Term 1 2019,"Main Campus, Kensington",0,1,"This course is an elective course, developed to be integral in the Masters of Dispute Resolution.  However, given the practical applicability of the subject matter, it provides an excellent complement to any Masters in Law program.
Main Topics
Development of international mediation and comparative approaches to mediation.Presence of non-adjudicative dispute resolution procedures in institutional rules.Issues arising out of the multiplication of procedures for the settlement of international disputes.Arbitration of private and mixed disputes- trends in arbitration; applicable law and institutions.Dispute resolution clauses and arbitration agreements.Investment Treaty Arbitration.The process of arbitration and enforcement and challenge of awards.Judicial jurisdiction in cases involving international business transactions.Provisional remedies and procedural problems in transnational business litigation.","Prerequisite: Academic Program must be either 9200, 9235, or 9201",6 Units of Credit
LAWS8023,Term 2 2019,"Main Campus, Kensington",0,1,"The course examines systematically and in-depth (to an extent not feasible in basic undergraduate Contract law courses) major principles of Australian law governing the performance, breach and termination of many commercial and conveyancing transactions. It is primarily concerned with complex applications of general contract law principles rather than the more specific rights that are sometimes conferred by statutes dealing with ""consumer"" contracts.As well as investigating many practical problems in applying the law, the course makes a sustained attempt to assist students to discern frequently unrecognised interrelations between legal principles, and thus to acquire a better integrated view of an area of law which (despite its practical importance) is widely regarded as amorphous and highly challenging. The course addresses a range of difficult practical, legal and evidentiary questions that have been raised in recent appellate judgements but often remain incompletely answered.
Main Topics
Contingent conditions precedent to performancePromissory and Concurrent conditionsDischarge by performanceNature of breachEntitlement to terminate for breach and repudiationEntire and severable contractsAffirmation following serious breachNature and consequences of termination for serious breach",Prerequisite: Academic Program must be either 9200 or 9201.,6 Units of Credit
LAWS8026,Term 3 2019,"Main Campus, Kensington",0,1,"Banking and Finance Law is a single session course that explores the law and practice of banking and finance.  The course is of particular relevance to those seeking to build their professional skills in modern banking and finance practice both in Australia and abroad.  Taught primarily by specialist practitioners from King and Wood Mallesons, the course takes a transactional approach to common financing techniques, the law and its practice.  Topics may vary from time to time but include traditional and current financing transactions including securitisation and derivatives, project and infrastructure financing as well as regulatory and insolvency issues in financing transactions.
Main topics
Financial regulation in AustraliaSecurity and guaranteesInsolvency issuesSecuritisationDerivatives, set-off and nettingProject and infrastructure financingDomestic and international debt capital marketsBilateral and multi-lender financingStructured and asset financingIssues and pitfalls in finance law",Prerequisite: Academic Program must be either 9200 or 9201.,6 Units of Credit
LAWS8037,Term 1 2019,"Main Campus, Kensington",0,1,"This course examines the use surveillance (the techniques of social control through the use of information technology) in both the public and private sectors, information privacy (or 'data protection') law and freedom of expression law as a response to security concerns. The pervasiveness of Internet use by business, government and citizens has surveillance, privacy protection, freedom of expression and security at the centre of the emerging information economy and information society. The course will examine issues, such as ‘fake news’, the Cambridge Analytica scandal, as well controversial Snowden revelations.  This subject examines surveillance, security and some of the legal and political underpinnings of democracy.  
Main Topics
Overview of information privacy and data protectionHow does technology enhance the protection/impinge on civil liberties?(Mass-) Surveillance and freedom of expressionCase studies",Prerequisite:Academic Program must be 9231 or 9220 or 9200 or 9214 or 9211 or 9201 or 9285,6 Units of Credit
LAWS8038,Term 2 2019,"Main Campus, Kensington",0,1,"There are so many distinctive Chinese characteristics in the corporate and securities laws which foreigners will find very interesting and sometimes puzzling. Recognizing the growing importance of China in the new world economy, this course is developed to address an area of both academic and practical importance. It will provide students with an opportunity to study selected issues of corporate and securities laws in greater detail than can be covered in the typical introductory Chinese law course. The course examines the Chinese law by comparison primarily with its Australian counterpart.
Main Topics
Introduction and China at a glanceThe Chinese legal systemChinese financial markets and regulatory frameworkIncorporation and Corporate personalityForeign investment enterprisesCorporate governance: an overview and assessmentDirectors' duties and independent directorsBankruptcy lawsFundraising and Disclosure regimeMarket manipulation and insider tradingTakeover (1): the overall frameworkTakeover (2): takeover offers and Anti-frustration rulesTakeover (3): Chinese M&A by foreigners",Prerequisite: Academic Program must be either 9200 or 9201.,6 Units of Credit
LAWS8040,Term 2 2019,"Main Campus, Kensington",0,1,"The course reviews the context of online content regulation through analysis of topics such as the foundations of copyright law, defamation law, etc. It identifies areas of the topic in which online content provides a particular or novel challenge, and then considers and discusses these areas in detail, focussing on theoretical analyses, policy directions, statutory materials and decided cases.
Most topic areas will be treated in a comparative fashion, considering not only the laws in force in Australia, but also the international context in the area, as well as developments in other major jurisdictions such as the US and the UK.
A comparative approach is also encouraged in the assessments, particularly in the research essay.
Main Topics
What unique features of the Internet create the need for new regulatory approaches?Will a particular regulatory approach achieve its objectives?What are the advantages/disadvantages of state-based v non-state-based regulatory strategies?What common regulatory strategies are being used, such as imposing liability on intermediaries?How do international agreements and the influence of other major jurisdictions (in particular the US) shape Australian laws?",Prerequisite: Academic Program must be 9200 or 9201 or 9231 or 9214.,6 Units of Credit
LAWS8052,"Summer Term 2019, Term 1 2019, Term 2 2019, Term 3 2019","Main Campus, Kensington",0,1,"The Human Rights Internship Program offers postgraduate students the opportunity to undertake advocacy, research or writing in collaboration with a partner organisation (either an external host partner organisation, a UNSW Law On Site Internships or a UNSW clinical course provider) with a focus on the protection and promotion of human rights and justice initiatives . Under the supervision of a member of the partner organisation and the Law Faculty, students will gain valuable experience in research, analysis, writing and advocacy on aspects of law, policy and practice relating to human rights and justice. Project topics must be related to human rights and justice law and policy and are to be negotiated between individual interns, partner organisations and the academic supervisor at UNSW Law School. Interns are required to undertake the equivalent of one full day each week of work at their partner organisation during session and to complete their project in close consultation with their partner organisation. At the end of the session, students will present a short presentation on the project which has been the subject of their internship.",Prerequisite: Academic Program must be 9200 or 9201 or 9211 or 9240.,6 Units of Credit
LAWS8066,Term 2 2019,"Main Campus, Kensington",0,1,"This course examines the origins, evolution and practice of international climate change law, tracing it  through to domains normally associated with private law and markets. It begins with an overview of the  scientific, economic and normative debates about climate change and then examines the Australian and international legal regimes related to climate change. This includes the United Nations  Framework Convention on Climate Change, its Kyoto Protocol and more recent negotiations. It will  consider the relationship between climate change and other areas of international law and  policy,  including forest protection and carbon trading.
The course examines ongoing debates about national emissions regulations, as well as more localised  attempts to build a low emissions economy. The course will provide international  comparisons to better  situate Australia’s legal regime.   
Main topics 
The science and economics of climate change History of the International climate regime Structure and framework of UNFCCC and Kyoto Protocol Climate finance and international development (REDD) Climate law and policy in Australia ‘Baseline and credit’ and other carbon pricing laws Carbon sequestration Case studies with cross-cutting issues with private law (such as property access for resource companies) Climate change litigation
The course will be useful for students intending to work in a wide range of practice areas, from commercial and energy law to planning, policy and international development. It will be valuable for students interested in the relationships between law, science, technology, ethics and government for a world where the boundaries between nature and culture are increasingly blurred by the shifting climate.",Prerequisite: Academic Program must be either  9200 or 9231 or 9220 or 8623 or 5499 or 7339 or 9212 or 9201.,6 Units of Credit
LAWS8068,Term 1 2019,"Main Campus, Kensington",0,1,"This course introduces the fundamental principles and concepts of Australian environmental law and policy. It provides a framework for understanding the environmental issues which humans are faced with today for managing the impact of our activities on the environment and the implications of these issues for law making and policy. Within that framework this course will cover key areas of environmental law in New South Wales and at the federal level. The course will touch on a number of cross-cutting themes that influence current debate in relation to environmental law and policy. These themes are taken up in other courses provided in the Environmental Law specialisation.
 
 
Main Topics
Global environmental issues and the development of international environmental lawThe common law and statute as sources of environmental lawCommonwealth environmental lawEnvironmental planningDevelopment controlEnvironmental assessment, enforcement and scrutinyBiodiversity conservation",Prerequisite: Academic Program must be either 9200 or 9201 or 8623 or 5499 or 7339 or 9212.,6 Units of Credit
LAWS8070,Term 1 2019,"Main Campus, Kensington",0,1,"Sustainable Energy Law will examine a number of controversial topics. The course focuses on sustainable energy issues, which is a broader category than merely renewable sources. As the course will highlight, the repeal of the Carbon Emissions Trading Scheme and the attack on the Renewable Energy Target have left a legal and policy vacuum for sustainable energy in Australia.
The course will focus of all aspects of sustainable energy law and policy, including those involving property law, land use planning, and utility regulation.  It will particularly focus on unresolved legal and policy questions relating to wind and solar energy development.  However, it will also include coverage of issues involving geothermal energy, biomass, biofuels, hydropower, and other important renewable energy technologies.
The course will also provide an examination of the role of nuclear energy in Australia and in other countries. It will examine specific policy issues affecting the regulation and management of the nuclear industry.
The course will conclude by exploring several legal and regulatory challenges emerging as Australia and other nations of the world seek to transition toward a more sustainable energy system, including issues related to energy storage technologies, smart meters and electric vehicles.
 
Main Topics
Introduction to Australia's renewable energy resources, current status of development and future prospects in a carbon constrained world;Overview of sustainable energy law in Australia;Renewable energy law frameworks: the CPRS and sustainable energy target legislation;Other legislative and policy incentives for promotion of sustainable energy;Renewable energy and regulation of the National Electricity MarketTechnology-specific state-based legislative regimes for wind energy and solar energy;Emerging legal regimes for off-shore sustainable energy (wind, wave and tidal energy)Legal issues concerning biomass and bio-fuelsPlanning approval, environmental impact assessment and sustainable energy projectsProperty law issues associated with renewable energy projects including turbine wake interference and regulating rights to solar access",Prerequisite: Academic Program must be either 9200 or 9201 or 8623 or 5499 or 7339 or 9212.,6 Units of Credit
LAWS8071,Term 1 2019,"Main Campus, Kensington",0,1,"This course introduces students to the legal framework regulating development and planning in NSW, exploring its ambitious and at times conflicting aims of economic development, environmental sustainability and social justice. We will consider the legislation and its evolution, examining recent reforms in the context of national and international trends in planning law and practice. Students will be encouraged to draw on their personal experience in Sydney and other cities around the world.
This course will prepare students for practice in environmental, property or real estate law, where a sound understanding of the planning framework is essential. It is also recommended for students interested in public policy: planning is a highly political process, particularly in Sydney where it regularly gives rise to fierce disputes in the media and the courts.
Main topics

Aims and origins of planning lawAssessment and approval of development in NSW, including major projectsThe relationship between planning and property lawTheory and practice of public participationEcologically sustainable development, climate change and planningHousing affordability, equity and social justicePlanning appeals and the NSW Land and Environment CourtRecent developments in planning law",Prerequisite: Academic Program must be either  9200 or 9231 or 9220 or 8623 or 5499 or 7339 or 9212 or 9201.,6 Units of Credit
LAWS8075,Term 1 2019,"Main Campus, Kensington",0,1,"The course focuses on the construction of knowledge about gender, race and ethnicity with reference to criminal justice; the legacy of colonial relations in Australia for Indigenous peoples and on criminal justice practices; and, how ideas about ethnicity and migration relate to gendered and racialised understandings of crime and within criminal justice.  The approach is comparative and inter-disciplinary, drawing on a wide range of historical, socio-legal and criminological research. Topics are likely to include: media representations of crime; gendered and raced patterns in violence; global mobility, migration, trafficking; policing; punishment; and developments in restorative justice and Indigenous justice.
The course provides a good grounding for further studies, and for practice, in criminal law, criminology and criminal justice.
Main topics are likely to include: 
media representations of crime;gendered and raced patterns in violence;global mobility, migration, trafficking;policing;punishment; anddevelopments in restorative justice and Indigenous justice.",Pre-requisite: Academic Program must be 9200 or 9285 or 9201.,6 Units of Credit
LAWS8076,Term 3 2019,"Main Campus, Kensington",0,1,"This course examines shifting notions of crime and responsibility for crime within criminal justice. It considers multiple meanings of criminal justice, such as in governing law and order, as dispute resolution, and in managing risk. It encourages a critical appreciation of criminal justice system responses to crime and engages with the need for criminal justice policy to respond to economic, social, political and cultural issues. The course will examine selected recent developments and ongoing debates in criminal justice.
 Main Topics
Bail and other pre-trial developmentsCompulsory treatmentSpecialised courtsRestorative justice and other forms of alternative justicePrivate and hybrid forms of securityThe move towards ‘pre-crime’",Pre-requisite: Academic Program must be 9200 or 9201 or 9285 or 9235.,6 Units of Credit
LAWS8077,Term 1 2019,"Main Campus, Kensington",0,1,"In a multi-dimensional society there is a need for groups to work together to deliver projects. These groups either need to build consensus for their decisions or vote by a majority. Examples include leadership committees, investigations and Boards. They are are often led by a chair or a facilitator. The role and expectation of the facilitator varies between groups and projects and the skills required vary accordingly. This course provides an exploration of the different contexts within which facilitation are used and an examination of the theoretical constructs. It is designed to provide students with an opportunity to have a greater insight into where there legal and ADR skills can be applied in a broader context.
This course provides an exploration of the different contexts within which facilitation is used. It looks then at the role of law in some of the contexts and the skills and tools that are required for anyone wanting to practice in the area. It is a theoretical course with exercises to provide an opportunity for practical application. This course includes an exploration of the following topics:

Main Topics 
An overview of facilitation, what are the cultural underpinnings and groups –how do they work and what is important to understand when working with a group or being part of a groupBoards, committees, the role of the chair, and the decision making processPsychological ‘Type” and groups; how do groups work, how are individuals types (such as MBTI) exhibited in a group environment and the implications for change management, and adult learning principalsThe application of facilitation in managing disputes in an Aboriginal context. An exploration of land based disputes and cultural paradigmsConflict and groups – from bullying in schools to sentencing circles the application of transformative justice and appropriate dispute resolution.",Pre-requisite: Academic Program must be 9200 or 9201 or 9235 or 9231 or 9220.,6 Units of Credit
LAWS8078,Term 1 2019,"Main Campus, Kensington",0,1,"Mediation is one most frequently used methods of dispute resolution in contemporary legal practice. It involves a third party neutral assisting parties in dispute to resolve their dispute using a process which does not rely on a determination.
The scope of mediation has broadened to include subtle differences in the role of the mediator.  The areas in which it has been used include:
Commercial enterprises  (such as commercial, intellectual property)Private Law impacting on the lives of individuals (Industrial, workplace and Family)Equity and diversity including discrimination and peer review as well as theCriminal Justice systems (victim/offender dispute resolution programs and restorative justice endeavours).
A model of mediation refers to the process employed, the scope, training and role of the third party neutral  (including the level of neutrality required) and the infrastructure that supports the process (private, court or government).  
This course provides an overview of mediation including an exploration of the various models, the nature and role of the third party neutral and an examination of various statutory regimes which have introduced court-annexed mediation.
It examines the ongoing development of mediation including the development of different processes called mediation, hybrid processes, the ethical challenges, the role of confidentiality, neutrality and the growing body of national and international case-law.
The course provides a solid foundation for those wishing to:
 recognise where mediation sits on the ADR continuumidentify what forms of mediation are available, what they might offer participants and what are the key elements of the various processes. Consider the role of the mediator in each of the different types of processes.
Main topics
Examination of various approaches including facilitative, evaluative and transformative.Exploration of  what a good outcome might look like  in different models of the process and how this may differ depending on whether the mediation arose by private agreement between the parties, through an industry sponsored scheme or via legislative regimes mandating the use of ‘mediation’An overview of and an opportunity to engage in the key elements of the mediation process, including how to determine the suitability of a dispute for mediation, mediator selection, pre-mediation preparation and post-mediation agreementsExploration of the role and conduct of the mediator, the parties and partisans such as legal advocatesLegal and ethical issues including a review of the growing body of current national and international case law.",Pre-requisite: Academic Program must be 9200 or 9201 or 9235 or 9231 or 9220.,6 Units of Credit
