Course,Term_Offerings,Campus,undergraduate_offered,postgraduate_offered,course_description,pre_requisites,course_uoc
LAWS3181,"Summer Term 2019, Term 3 2019","Main Campus, Kensington",1,0,"One of the most important areas of international law is the law regulating recourse to and the use of force. It is a unique body of law comprising two separate and distinct bodies of rules: the jus ad bellum, which is the law governing the legality of the resort to force, and the jus in bello, which is the law regulating the conduct of hostilities. The jus in bello is also referred to as humanitarian law, the law of armed conflict, or the laws of war. The law of armed conflict is a body of rules that was developed to protect the most vulnerable groups during armed conflict and to mitigate the deleterious effects of the methods of warfare.
The course is designed to provide an overview of the fundamental principles of the law of armed conflict (or international humanitarian law). It will place international humanitarian law within public international law more generally, and delineate its relationship to other areas of international law (such as the international law of human rights). Specifically, the course will cover the principles and rules relating to the protection of individuals during armed conflict, as well as rules relating to the means and methods of warfare, including weapons issues. We will also explore issues relating to the implementation and international and national enforcement of international humanitarian law.
Main Topics
the position of international humanitarian law within public international lawthe relationship between rules related to the right to use force and international humanitarian lawthe historical development of international humanitarian law normsthe principles determining the rules applicable in different conflict situations, or issues of classification of conflictsrules related to the protection of persons during armed conflict, as well as situations of violence not amounting to armed conflictrules and principles regarding the means and methods of warfare, including weapons issuesthe relationship between international humanitarian law and international human rights lawimplementation and enforcement of international humanitarian law,  including a brief overview of the international tribunals for the former  Yugoslavia and Rwanda, and the International Criminal Court, as well as  national enforcement of international humanitarian lawchallenges and potential new directions for international humanitarian law, including issues raised by terrorism,the role of the ICRC and the Red Cross Movement in armed conflict, and the work of governments, other international organisations and NGOs.",Prerequisite: Completion of 78 UOC in LAWS courses.,6 Units of Credit
LAWS3182,Term 1 2019,"Main Campus, Kensington",1,0,"This course examines the fundamental legal standards and institutions of international human rights law through the medium of contemporary human rights concerns. It will familiarise you with the basic principles of international human rights law and the mechanisms for its enforcement and provide an exploration off the role of international human rights norms in domestic legal systems (with a focus on Australia).
This course aims to provide students with an introductory engagement with the substance, institutions and techniques of international human
rights law.
The specific topics covered vary from year to year and may include:
narratives of the history of human rights;universalism and cultural relativism;the United Nations human rights system;regional systems for the protection of human rights;techniques of interpretation of human rights;the nature of State obligation;death penalty;freedom of expression;economic, social and cultural rights;human rights and terrorism: the role of business in protecting human rights;domestic implementation of international human rights in Australia.
Main Topics
What are human rights?Who enforces human rights?The UN and human rightsInterpreting rights: techniques and sourcesBusiness and human rightsSocial media and human rightsGenocideAustralia and Human Rights",Prerequisite: Completion of 78 UOC in LAWS courses.,6 Units of Credit
LAWS3183,"Summer Term 2019, Term 1 2019, Term 2 2019, Term 3 2019","Main Campus, Kensington",1,0,"The Australian Journal of Human Rights (AJHR) is a publication of the Australian Human Rights Centre (AHRCentre) at UNSW Australia.
The AJHR is Australia's first peer reviewed journal devoted exclusively to human rights development in Australia, the Asia-Pacific region and internationally.  The law journal aims to raise awareness of human rights issues in Australia and the Asia-Pacific region by providing a forum for scholarship and discussion.
The AJHR examines legal aspects of human rights, along with associated philosophical, historical, economic and political considerations, across a range of issues, including aboriginal ownership of land, racial discrimination and vilification, human rights in the criminal justice system, children's rights, homelessness, immigration, asylum and detention, corporate accountability, disability standards and free speech.
 
Program and Supervision
The Student Editors will play an active role in the production of one of the LAW publications and journals. A student editor will - See more at: http://www.law.unsw.edu.au/current-students/law-action/internships/publications#sthash.s5cxSQXH.dpuf
 As the Managing Student Editor you will be the frontline interface between the journal and contributors, facilitating the intake, review and publication of the journal.  You will work closely under the supervision of the editors Chris Michaelsen (Law), Justine Nolan (Law) and Claudia Tazreiter (FASS).  You will further have the opportunity to develop your proofing and writing skills, and form contracts with leading academics and organisations in the field.
The Editorial Board is comprised of: Prof Andrew Byrnes, Prof Andrea Durbach, Prof Richard Hugman, Dr Ben Golder, Prof Danielle Celermajer (USyd), Prof Kelly Loper (HKU) and Dr Christine Binder (Vienna). 
 
Course Objectives
At the end of this course, students should:
Have developed an appreciation for the professional and personal responsibilities associated with the publishing of a human rights publication.Undertake self management by completing activities, such as editing articles and liaising with contributors, associated with the position to a high standard and within deadlines.Demonstrate effective oral communication skills by successfully liaising with contributors in a persuasive and appropriate manner to meet publication deadlines.Improve written communication skills by completing two articles/blogs appropriate to the theme of the AJHR or other written material that may or may not appear in the edition.Communicate effectively, in speaking and in writing. 
The Student Editors will play an active role in the production of one of the LAW publications and journals. A student editor will:
researchedit and proof articles, interviews, book reviews,liaise and form relationships with organisations, academics and members of the legal profession
And a range of other tasks connected with the production of the journals as directed by the Editors.
- See more at: http://www.law.unsw.edu.au/current-students/law-action/internships/publications#sthash.s5cxSQXH.dpuf
The Student Editors will play an active role in the production of one of the LAW publications and journals. A student editor will:
researchedit and proof articles, interviews, book reviews,liaise and form relationships with organisations, academics and members of the legal profession
And a range of other tasks connected with the production of the journals as directed by the Editors.
- See more at: http://www.law.unsw.edu.au/current-students/law-action/internships/publications#sthash.s5cxSQXH.dpuf",Prerequisite: Completion of 78 UOC in LAWS courses.,6 Units of Credit
LAWS3185,Term 3 2019,"Main Campus, Kensington",1,0,"Public Interest Litigation: Origins and Strategies will examine how to realise human rights and advance social justice through the practice of law. The course will trace the emergence of the public interest litigation (PIL) movement by reference to the use of law in shaping social policy in different jurisdictions, including America, India, Israel, Canada and South Africa. Students will evaluate various litigation strategies adopted to advance a public interest in the Australian context. Topics covered will include: test case litigation, amicus curiae interventions, class actions or representative proceedings, and litigating Bills of Rights; barriers to conducting PIL, including standing, resource constraints and the risk of adverse costs orders. A critical aim of the course is to encourage students to recognise both the value and limitations of public interest litigation. Students will be asked as part of the course assessment to select a topic of contemporary public interest and devise a litigation strategy to advance an issue of social importance.
The courses 'Public Interest Litigation: Origins and strategies' and 'Legal aid and global justice lawyering: Issues in Practice’ are complementary courses and interested students are encouraged to enrol in both.
Origins and history of the public interest law movementThe emergence of PIL in different jurisdictions eg India, America, South Africa, Australia, Canada and South AmericaWorking with barriers to PIL eg standing, limited resources and risks of costs orders, judicial systemsPIL strategies (illustrated by reference to case-studies) eg test-case litigation, class actions/representative proceedings, amicus curiae interventions, administrative reviewLitigating Bills of Rights (USA, Canada, SA and the UK Human Rights Act) - litigating civil/political and economic, social and cultural rightsInvoking international mechanisms and procedures eg Optional ProtocolsSecuring the public interest via alternatives to litigation eg arbitration, mediationSupplementing PIL eg via policy interventions, developing parallel campaigns, working with the mediaWorking with communities and public interest clients - ethical and political considerations",Prerequisite: Completion of 78 UOC in LAWS courses.,6 Units of Credit
LAWS3186,"Term 1 2019, Term 2 2019, Term 3 2019","Main Campus, Kensington",1,0,"The Human Rights Defender (HRD) is a publication of the Australian Human Rights Centre (AHRCentre) at the University of New South Wales.  The Defender was first published in 1992 and continues to provide a platform for the expression of critical thinking and the discussion of conceptual developments in human rights.
The Australian Human Rights Centre is a multidisciplinary research centre and our contributors are economists, lawyers, sociologists and philosophers as well as human rights workers, artists and writers.  We publish the work of established writers and artists as well as students.  Our intention is to provide information and comment on a broad range of current issues in human rights and to be newsworthy and relevant.
The Defender highlights issues not always covered in mainstream media and other human rights publications.  We seek to appeal to all those with an interest in and commitment to human rights and, in particular, to bring together individuals and organisations involved in human rights advocacy and education.

Program and Supervision
As the Managing Student Editor you will be responsible for liaising with various organisations and individuals to commission articles for the Defender.  The Student Editor will be required to write an article (1,500-1,800 words) to be published in the magazine.  You will also be required to contribute 2 blog posts on current topics for the centre website.  You will be working as part of a team within the Defender and also within the AHRCentre.  You will gain skills in editing and proofing, writing, working with and coordinating volunteers, and commissioning and forming relationships with other human rights organisations, academics and members of the legal profession.  Students work under the supervision of the Human Rights Defender editors during the internship.  The current editors of the HRD are Daniel Joyce, Beth Goldblatt, Jed Horner,and Janice Gray.  Our photo editor, design and production manager is Diane Macdonald.  Our consultant editor is Centre Director Andrea Durbach.
Interns are required to attend at the Centre for the equivalent of one day each week over the session, and to undertake additional work in libraries and elsewhere on a flexible basis arranged individually with each intern. Interns are closely involved in the editing process of each issue of the Defender.
At the end of the course, students should:
Have developed an appreciation for the professional and personal responsibilities associated with the publishing of a human rights publication.Undertake self-management by completing activities, such as editing articles and liaising with contributors, associated with the position to a high standard and within deadlines.Demonstrate effective oral communication skills by successfully liaising with contributors in a persuasive and appropriate manner to meet publication deadlines.Improve written communication skills by completing an article appropriate to the theme of the Human Rights Defender edition or other written material that may or may not appear in the edition.Communicate effectively, in speaking and in writing.",Prerequisite: Completion of 78 UOC in LAWS courses.,6 Units of Credit
LAWS3187,Term 2 2019,"Main Campus, Kensington",1,0,"This course introduces students to the international legal regime for forcibly displaced persons. The first part of the course focuses on the 1951 Refugee Convention, including who qualifies for refugee status, the protections afforded to refugees and the procedures for refugee status determination. The second part of the course considers the capacity of the current international legal framework to respond to displaced persons who do not fall within the Refugee Convention, such as internally displaced persons, persons fleeing human rights abuses or civil war, and those whose movement is a result of climate change or environmental catastrophe. The course considers the theoretical underpinnings of the international forced migration regime and queries why States have agreed to protect certain categories of persons and not others, and whether this is legally and/or ethically sound.
This course considers the legal obligations of States and international organisations to assist and protect forced migrants. While the focus of the course is on international law responses to issues of forced migration, consideration will also be given to the relationship between the international legal regime and domestic law. In particular, this course will provide an opportunity to discuss current issues in forced migration regulation in Australia.
This course relates to and extends learning from other courses in the Law School, including Public International Law, International Humanitarian Law, Asia Pacific Migrant/Refugee Rights Intern Program, Australian Immigration Law and Practice, International Human Rights Law and Advocacy, Public Interest Internship Program, and the Social Justice Intern Program. 
Main Topics
Conceptualising 'forced migration'The international refugee law regimeClimate-induced displacementThe role of human rights law: complementary protectionProtection in mass influx situationsThe role and function of UNHCRThe ethics and politics of humanitarian assistanceDevelopment-induced displacementThe asylum-migration nexusThe right to seek and enjoy asylumStatelessnessSmuggling and trafficking",Prerequisite: Completion of 78 UOC in LAWS courses.,6 Units of Credit
LAWS3192,Term 3 2019,"Main Campus, Kensington",1,0,"This course builds on your knowledge of Business Associations but focuses on issues relating to public companies, particularly large public companies. The course focuses on legal issues related to disclosure as a form of regulation, the terms and conditions imposed when a company wishes to raise funds from the public and the market for corporate control. Another important focus for the course is to examine the role of the key regulatory agencies, ASIC and the ASX, as bodies regulating companies and capital markets.
The course is a specialist subject for those with a strong interest in corporate and securities law. It is important for those wishing to pursue a career in this field as a commercial lawyer or barrister, as an investment banker, as a policy adviser in Government or a regulatory agency, or in legal publishing.
Main Topics
Securities regulatorsContinuous disclosureFundraisingTakeoversMarket integrity.
The areas of law covered in this course are:
The role of ASIC and the ASX as bodies regulating companies and capital marketsThe continuous disclosure of information to securities marketsThe terms and conditions upon which companies may raise funds from the public, ie, the issue and content of prospectusesThe structure and regulation of the market for corporate control (ie, takeovers), including a study of the role of the Takeovers Panel and the regime of compulsory acquisitionThe legal regimes relating to insider trading and market manipulation.",Prerequisite: Completion of 78 UOC in LAWS courses including Business Associations (LAWS1091).,6 Units of Credit
LAWS3196,Term 3 2019,"Main Campus, Kensington",1,0,"This course will teach students how to design legal information systems, integrating expert systems, hypertext, text retrieval and other technologies, for use in generating legal documents from precedents and assisting users to navigate solutions to legal problems. After learning the necessary skills, students will work in small groups, in partnership with a not-for-profit centre or organisation, to design and build a legal information system.
In class, students will also be exposed to a variety of examples of automation of legal tasks, and the various legal and practical issues associated with their use, including issues of professional regulation. This will include guest lectures from those working on legal expert systems and related technologies. Students will also become familiar with theoretical approaches to legal information systems development, and the range of technologies and approaches that may contribute to applications development.
Designing legal information systems requires students to think through a class of legal problems in a structured way. Systems can be used to generate legal documents from precedents, with variations based on the responses of a user, as well as to answer legal questions within a particular field. They are one component of the increasing tendency to automate legal tasks. Used well, legal information systems can facilitate access to legal information and expertise, but always within the limits of their designer's foresight. Designing a good legal information system thus requires skills in legal analysis and problem-solving, as well as the ability to think creatively and explore different approaches to a problem.
This course does not require students to have any pre-existing skills or experience in expert systems or computer programming - the course itself includes instruction on how to use expert system software.
This course is sponsored by Gilbert and Tobin.
Main Topics:
Limitations of legal information systems
Legal information systems and professional regulation
Privacy and data protection
Project management",Prerequisite: Completion of 78 UOC in LAWS courses.,6 Units of Credit
LAWS3216,Term 3 2019,"Main Campus, Kensington",1,0,"After two centuries of increasingly intensive urbanisation, people are more disconnected from food production than they have ever been before. A minority of the world’s population grow food, and in highly urbanised countries that minority is vanishingly small. Less than 0.01% of Australians are employed in agriculture of any kind. Modern agriculture is industrialised and food production corporatized. However, across the globe, there is a growing movement to reconnect with food production and to critically examine how food reaches our tables. Researchers and food activists are highlighting the social, cultural, ethical and environmental costs of modern food production, and exploring alternatives to industrial food systems.
This course will introduce students to a broad range of legal and policy issues, at both domestic and international level, that relate to food. Drawing on the expertise of multiple teachers, topics may include:
Regulatory models that affect food production and distribution, including international covenants on food security and food aid, environmental laws, patents, trademarks, cultural heritage laws, biotechnology and health standards, animal rights, consumer laws and local government/planning law;
Biotechnology and food production, including the demise of historical prohibitions on agricultural patents and public interest litigation around patenting life forms; the distinction between discovery and invention and its consequence; the distinction between open-pollenated seeds, hybrids and GMOs; contemporary developments in agribusiness and biotech patenting; plant variety rights; seed saving and farmers’ rights;
The environment and food, including the environmental impact of nutrient and pesticide pollution, biodiversity loss and deforestation, water overuse, carbon emissions and waste; legal and regulatory regimes designed to respond to these challenges, illustrated through case studies such as the pollution of the Great Barrier Reef by agriculture run-off; the regulation of water use in agriculture (70% of the world’s water) and in the food chain (two thirds of our total water footprint), including legal rights to surface and groundwater, water planning, allocations, efficiency approaches, markets, pricing and enforcement;
Aboriginal science and rights to food, including an Indigenous Knowledges perspectives on science, agriculture and property rights to water, land, plants and animals, and data sovereignty; the regulation and use of this knowledge, including global initiatives around biopiracy; access and benefit sharing agreements; creative commons licensing; traditional knowledge databases; regional WIPO initiatives;
Diverse legal models of enterprise in the food sector, particularly those that link production and distribution in innovative ways; the intersection between the sharing economy and the food system; the potential for innovative domestic models to help realise food-related international Sustainable Development goals;
Urban agriculture, including the challenges of reconnecting overwhelmingly urban populations with food growing and production; legal rights to access land through public and private law; grassroots activism, community groups, allotments and guerrilla gardening, in Australia and overseas.
Interactive classes on a range of issues will give students a broad understanding of laws and policies that relate to food.  Classes may vary from term to term, depending on staff availability. A research essay on a self-selected topic will allow students to develop food research skills, as well as an in-depth understanding of a single area.",Prerequisite: Completion of 78 UOC in LAWS courses.,6 Units of Credit
LAWS3221,Term 2 2019,"Main Campus, Kensington",1,0,"This course focuses on the principal legal areas affecting media content. An underlying theme of the course will be the relationship between free speech and the legal restrictions imposed upon the media. You will find also that the course builds on your knowledge of a variety of legal topics already studied in your program, such as, for example, torts, criminal law, and constitutional law, but requires you to rethink these areas from the perspective of how they impact upon media as they carry out their roles of reporting and commenting. The course will cover the core areas of media law and its general principles. We will also consider new frontiers and contemporary case studies involving digital and social media.  The media landscape is transforming and we examine how media law frameworks can be reformed and/or further developed to address the challenges involved.
Main Topics
freedom of speech and offensive speechmedia ownershipopen justice and contempt of court (including the protection of sources)defamation lawprivacy and breach of confidencedigital media regulation",Prerequisite: Completion of 78 UOC in LAWS courses.,6 Units of Credit
LAWS3222,Summer Term 2019,"Main Campus, Kensington",1,0,"The course focuses on the regulation of electronic communications in Australia. This is a very topical course with current issues including Australian content in the electronic media, the roll out of the National Broadband Network and Internet Governance.  The course will cover the regulation of telecommunications, broadcasting and online services. Specifically, the course will include the following:
Introduction to the communications regulatory environment including the regulators, differing regulatory structures and legislation frameworksRegulating communications transmission services (including the Internet) including
	The technologyThe providers of infrastructure and servicesCompetition and consumer protection
Regulating (or not) content services including
	Planning and licensing of servicesMedia ownership, including foreign ownershipCompetition regulation
Convergence – of platforms, of services and implications for media regulation",Prerequisite: Completion of 78 UOC in LAWS courses.,6 Units of Credit
