Course,Term_Offerings,Campus,undergraduate_offered,postgraduate_offered,course_description,pre_requisites,course_uoc
LAND2122,Term 2 2019,"Main Campus, Kensington",1,0,"This course is a survey of the history of gardens and designed landscapes from Ancient Greece through to the twentieth century. The course engages students in a critical analysis of cultural landscapes through the investigation of philosophical, aesthetic and social aspects of landscape architecture and garden art in the Eastern and Western traditions.",Prerequisite: LAND2121,6 Units of Credit
LAND2142,Term 2 2019,"Main Campus, Kensington",1,0,"This course encourages students to develop a personal vocabulary of landscape representation techniques to facilitate the development and communication of design ideas.  Students develop a range of communication techniques including 3D visualisation (perspective sketches, montages, 3D and terrain modeling), colour rendering, and the use of digital media generally.  The course introduces Computer Aided Design in 2D and 3D.  The integration of these outputs will be explored across the digital suite.  The course builds on and links with the physical media skills learned in LAND1141 to develop a high level of spatial and graphic thinking.",Pre-requisite: LAND1141,6 Units of Credit
LAND2151,Term 1 2019,"Main Campus, Kensington",1,0,"This course focuses on the observation and interpretation of the environment with a particular emphasis on the interrelationship between geology, climate, soils, hydrology, flora, fauna and humans.  Concepts of ecology, sustainability, biodiversity, habitat fragmentation, and landscape ecology are introduced.  Students review the fundamental characteristics of a range of regional ecosystems, and analyse human modification of the environment.  Through a range of assessment tasks, students record and analyse the landscape using inventory, survey, mapping, reporting and presentation techniques associated with the practice of landscape architecture.  The course involves several excursions to local sites.  Students are asked to contribute to the cost of these excursions.",No Prerequisites,6 Units of Credit
LAND2152,Term 3 2019,"Main Campus, Kensington",1,0,"This course builds on the knowledge of plants introduced in LAND2151 Landscape Analysis and focuses on the aesthetic and cultural aspects of plants in site-specific design contexts. The course introduces basic botanical terminology and taxonomic classification, along with plant structure, form and function to reinforce identification and understanding of their potential application in planting design. Principles of planting design are explored through the study of historic and contemporary landscape architectural designs. The course involves several excursions to local sites, and students are asked to contribute to the cost of these excursions.",Prerequisite: LAND2151,6 Units of Credit
LAND2201,Term 1 2019,"Main Campus, Kensington",1,0,"This studio concentrates on two major themes in landscape architecture - landform and planting.  Landform consideration includes investigation into the relationship between topography and natural systems, constructed environments and ecological sustainability.  Design projects involve the manipulation of landform to achieve a range of functions for a real site.  The planting component of this studio builds on plant knowledge and use from previous courses.  Students apply this knowledge to the planting design of a real site, together with consideration of the relationship between landform and plants.  Specific projects may include water sensitive urban design, constructed wetlands, historic perspectives on the use of plants, land art, or the design of transport or recreation precincts.  An integral part of the course is the presentation of a sketch book that demonstrates a wide range of graphic and design skills, and includes examples of design precedents.",Prerequisite: LAND2152 and LAND2102,6 Units of Credit
LAND2202,Term 2 2019,"Main Campus, Kensington",1,0,"This studio focuses on design resolution and documentation of one project. The project requires consideration of people / place issues, environmental considerations and use of precedents. The design phase includes preparation of design options to express each student's appraisal of the site and client brief and to demonstrate evaluation of priorities. Verbal and graphic presentation of the design process and final design resolution to a jury concludes the design phase. The documentation phase requires each student to prepare a set of working drawing documents, using CAD, to describe all or selected parts of their design. The expected standard of documentation is to the industry standard of communication of the technical components of the design's construction to a landscape contractor.","Prerequisite: LAND2201, LAND2271",6 Units of Credit
LAND2251,Term 1 2019,"Main Campus, Kensington",1,0,"This course builds on the knowledge of plant communities introduced in LAND2151 Landscape Analysis and focuses on plants as components of urban ecological landscape patterns at the landscape and metropolitan scales. It examines the role of plants in various situations, for example, in landscape remediation and regeneration, planning for climate change resilience, serving as 'green infrastructure', and protecting riparian and wetland areas. The course involves an excursion to a local site, and students are asked to contribute to the cost of this excursion.",No Prerequisites,6 Units of Credit
LAND2271,Term 1 2019,"Main Campus, Kensington",1,0,"This course introduces students to the principles of documenting landscape projects for construction.  Topics covered include material selection, standard construction practices, introduction to relevant Australian Standards, grading, earthwork calculations, drainage design, detailing and sustainable design and construction practices.",Pre-requisite: LAND2102,6 Units of Credit
LAND2272,Term 2 2019,"Main Campus, Kensington",1,0,"This course focuses on understanding and applying the structural design and construction techniques for a range of difficult site problems, such as earthworks, drainage, constructed wetlands retaining and free standing walls, pavements, roads and structures. Assessment is based on critical analysis of structural design, and the design, documentation and detailing of a range of materials, elements and structures. All students are required to have completed their Industry Work Experience requirements to satisfactorily complete the course.",Prerequisite: LAND2271,6 Units of Credit
LAND2311,Term 1 2019,"Main Campus, Kensington",1,0,"Students extend their design and analysis abilities by preparing master plans for medium scale sites.  Design proposals are developed as responses to site qualities and a program of uses, with a particular emphasis on the spatial, social and ecological systems of the landscape.  Students learn to integrate ecological, social and aesthetic considerations as part of the design process and are introduced to the application of design for sustainability.  There is an emphasis on developing, testing and communicating design concepts and extending presentation skills",No Prerequisites,6 Units of Credit
LAND2312,Term 2 2019,"Main Campus, Kensington",1,0,"Students extend their design and analysis abilities by preparing master plans for medium scale sites.  Design proposals are developed as responses to site qualities and a program of uses, with a particular emphasis on the spatial, social and ecological systems of the landscape.  Students learn to integrate ecological, social and aesthetic considerations as part of the design process and are introduced to the application of design for sustainability.  There is an emphasis on the performance of the design concepts created.",No Prerequisites,6 Units of Credit
LAND2411,Term 1 2019,"Main Campus, Kensington",1,0,"This course investigates the interdependency of landscape and urban morphology by testing large-scale urban design propositions within a particular landscape and responding to current government planning documents and aspirations for the site. Students learn about urbanisation and site issues through lectures and guest presentations by relevant stakeholders and practitioners. This information, along with site analysis and precedent studies, enables students to develop urban landscape design frameworks that respond sensitively and creatively to the issues facing the site. This course generates the urban design context for the individual project developed in LAND2412 Landscape Studio 9.",No Prerequisites,6 Units of Credit
LAND2412,Term 2 2019,"Main Campus, Kensington",1,0,"This course investigates landscape architectural knowledge and approaches across a range of scales including district, neighbourhood, city block and city space. The course will explore and refine skills in resolving public domain areas through the lens of particular landscape architectural concerns such as ecological and social processes. Theoretical knowledge underpinning the selected topics explored are developed concurrently in LAND2421 Contemporary Theory and Research.",No Prerequisites,6 Units of Credit
LAND2421,Term 1 2019,"Main Campus, Kensington",1,0,"Students develop in depth knowledge of contemporary landscape design through a detailed review of current projects, built works and writings. Students will investigate and test current theories of design in landscape architecture, through the critical analysis of recent work. Current concerns in landscape design will be reviewed against the trajectory of twentieth century modernism. Development of the critical methodological and stylistic skills involved in researching, writing and presenting essays, theses, articles, papers and reports. Each student researches and prepares a literature review, a seminar presentation and a research paper.",Pre-requisite: LAND1322,6 Units of Credit
LAND7101,Term 1 2019,"Main Campus, Kensington",0,1,"This is the first design studio in Stream A of the MLArch.  It develops design thinking and skills by requiring students to integrate programmatic requirements into the design process.  Design projects focus on landscape systems to address the spectrum of contemporary site planning concerns: access, circulation, water quality and drainage, social equity, biodiversity and resilience.  Students develop skills in analytical and conceptual thinking by working on medium scale sites, and the ability to test and integrate ecological, social, aesthetic and temporal aspects of landscape performance into the design process.",No Prerequisites,6 Units of Credit
LAND7102,Term 2 2019,"Main Campus, Kensington",0,1,"Design projects in this studio require the consideration and resolution of multiple and complex issues. Projects will have an environmental, social, and aesthetic focus and may include preparing competition entries and/or be interdisciplinary in nature. Students will refine their professional skills working individually and in small groups. Presentation skills will be extended to a professional level, incorporating a range of media, including models, and applications using a range of computer software.",No Prerequisites,6 Units of Credit
LAND7121,Term 3 2019,"Main Campus, Kensington",0,1,"This postgraduate course explores the extensive body of environment-behaviour research and theory on people’s relationship to place. Students will gain an understanding of the range and complexity of needs of specific users in the design of public spaces in which they live, work and play. Individual perceptions of shared and personal space, universal design and social inclusion will be explored, along with considering how planning and design contribute to social and environmental sustainability in communities. Most of the ideas and concepts discussed will be relevant to all environments and all types of design but for this course the focus will be on public spaces and environments in the public domain.",No Prerequisites,6 Units of Credit
LAND7151,Term 1 2019,"Main Campus, Kensington",0,1,"This postgraduate course builds students’ knowledge of plants and plant communities and focuses on plants as components of urban ecological landscape patterns at the site, landscape and metropolitan scales. It examines the role of plants in various situations, for example, in landscape remediation and regeneration, planning for climate change resilience, and serving as ‘green infrastructure’, and protecting riparian and wetland areas. The course involves excursions to local sites, and students are asked to contribute to the cost of these excursions.",No Prerequisites,6 Units of Credit
LAND7152,Term 3 2019,"Main Campus, Kensington",0,1,"This course examines the influence of urban ecology on the practice of landscape architecture over the last 50 years.  The course explores both the theoretical and practical applications of urban ecology principles and concepts as applied to established, regenerated and new urban landscapes. 
The course draws on both international and local case studies to map the trajectory key ideas, projects and designers which influenced changes in the role of ecology in relation to landscape design. Topics include: succession, climax systems; landscape ecology, ecological urbanism, and landscape urbanism.",No Prerequisites,6 Units of Credit
LAND7201,Term 1 2019,"Main Campus, Kensington",0,1,"Landscape architects are most often engaged in the planning and design of open spaces in the public realm including streets, paths, plazas, parks, waterways and coastal edges. 
Through five themes, being: typology, interface, strategies, policy and people, this course examines the varied demands placed on the public realm in an urban context and equips students with approaches to the strategic planning and design of public realm at the precinct scale. 
During the course students will develop knowledge in the spatial and functional requirements and user expectations of a range of public realm types and their relationship to each other and built form. Students will learn approaches to public realm policy, strategies and design that responds to various spatial and stakeholder conditions.",Prerequisite: LAND7102,6 Units of Credit
LAND7202,Term 2 2019,"Main Campus, Kensington",0,1,"This studio approaches the designed landscape from an ecological perspective. The design process in the studio relies on ecological knowledge to inform, inspire, and shape the designed landscape. Different types of constructed ecologies are examined, including urban parks, constructed wetlands; green infrastructure; urban forests; green roofs and walls. Studio projects focus on the catchment scale and take landscape design as a critical and creative means of improving ecological and social performance. Skills in landform manipulation, wetland construction, and planting for climate and habitat health are integrated into the design agenda. Projects incorporate digital technologies as a means of testing design propositions.","Prerequisites: LAND7201, LAND7211",6 Units of Credit
LAND7211,Term 1 2019,"Main Campus, Kensington",0,1,"This course focuses on case studies as mode of learning and a foundation for applying critical thinking to design practice.  The theory of case studies as a research method in landscape architecture serves a starting point for students to prepare individual case studies of key works of landscape architecture. The course situates key precedents of the landscape architectural canon in their social, political, environmental and economic contexts and develops the capacity to identify and apply design and planning principles /strategies to inform design practice. This course takes a particular focus on the social considerations of planning and designing for people in cities.",No Prerequisites,6 Units of Credit
LAND7221,Term 1 2019,"Main Campus, Kensington",0,1,"This course introduces students to the visualisation of complex landscape systems and dynamics, using visual scripting interfaces and technologies such as Rhino, Grasshopper, Photoshop, 3D Studio Max, and the HoloLens. Students explore design decisions by simulating and evaluating changes to environmental conditions with a focus on landform, hydrology and planting.",No Prerequisites,6 Units of Credit
LAND7272,Term 2 2019,"Main Campus, Kensington",0,1,"This course is a co-requisite for LAND 7202: Master Landscape Studio 4: Constructed Ecologies. The course develops the knowledge and ability to address the technological challenges of constructed ecologies, their construction systems and methods, and their performance. The material focus is on landform, stormwater and vegetation.  Techniques of grading, earthworks, and drainage are explored.  Digital modeling and fabirication are used to increase student's capacity to communicate and test design options; the digital model developed in this course are integrated into the con-current studio project.","Prerequisites: LAND7201, LAND7211",6 Units of Credit
LAND7301,Term 1 2019,"Main Campus, Kensington",0,1,"This studio takes landscape systems at the city scale as a framework for design.  Landscape systems span and shape cities and urban regions, as well as political boundaries. Landscape systems include geology, hydrology, vegetation, habitat, transportation, open space, infrastructure and built form. All these systems exert environmental impacts which affect quality of life at many scales-- the metropolitan, the city, the precinct, the neighbourhood as well as local streets and spaces. In this studio, students consider how metropolitan landscape systems have informed and shaped urban settlement, and vice versa. In a suite of directed design projects, students are given a future scenario which guides and challenges their design thinking in terms of scale and complexity. During the course students will develop knowledge of the relationship between landscape systems and urban settlements and extend their abilities to plan and design landscapes as integrated components of city and metropolitan systems.",Prerequisite: LAND7202,6 Units of Credit
LAND7302,"Term 2 2019, Term 3 2019","Main Campus, Kensington",0,1,"Studio 6 is the culminating design studio in the UNSW MLArch degree. Together with LAND 7311, this course is the studio component of an independent, year-long research and design process.  Students initiate their design proposition in LAND 7311, setting their own design research agenda within the structure of a collective studio project.  Every year Studio 6 identifies a relevant contemporary theme or issue which serves as the framework for the individual, design-based research projects. Each student develops a topic of their choosing and works closely with staff and peers in the studio to develop and test their design propositions.",Prerequisite: LAND7301,12 Units of Credit
LAND7311,Term 1 2019,"Main Campus, Kensington",0,1,"Students engage in a  process of  scholarly exploration through contemporary landscape architectural works and theories in relation to  the design process and design research. Students develop skills in research design and methods, critical review, research by design, documentation and writing. Students prepare an achievable, theoretically-informed research proposal which forms the basis of the design work in the  Capstone Studio.",No Prerequisites,6 Units of Credit
LAND7321,Term 1 2019,"Main Campus, Kensington",0,1,The course explores innovative landscape materials and emerging approaches to design development and construction. Students develop their capacity to transform landscape design concepts into tangible and workable landscape proposals through the methods and techniques of design development. Creative exploration of material properties is introduced alongside traditional systems of landscape construction and industry standards.,No Prerequisites,6 Units of Credit
LAWS0001,"Term 1 2019, Term 2 2019, Term 3 2019","Main Campus, Kensington",0,0,N\A,N\A,N\A
LAWS0002,"Term 1 2019, Term 2 2019, Term 3 2019","Main Campus, Kensington",0,0,N\A,N\A,N\A
LAWS0007,"Term 1 2019, Term 2 2019, Term 3 2019","Main Campus, Kensington",0,0,N\A,N\A,N\A
LAWS0008,"Term 1 2019, Term 2 2019, Term 3 2019","Main Campus, Kensington",0,0,N\A,N\A,N\A
LAWS0009,"Term 1 2019, Term 2 2019, Term 3 2019","Main Campus, Kensington",0,0,N\A,N\A,N\A
LAWS1021,"Term 1 2019, Term 2 2019","Main Campus, Kensington",1,0,"LAWS1021 is only available in T2 by School Consent. Contact  UNSW Law Students Services for more information. 
This course introduces students to fundamental aspects of criminal justice and process. Woven through the course is a critical examination of the interaction between the criminal justice system and the criminal law: specifically, that application of the law is shaped by and dependent on decisions made by criminal justice actors including police, prosecutors and judicial officers. Specific areas of focus include: why some activities are criminalised and others not; the use and misuse of discretion; the impact of the reliance on summary justice; the significance of pre-trial processes such as search, arrest and bail; and the over-representation of Indigenous people and other vulnerable groups.

Crime and the Criminal Process also introduces the doctrinal building blocks of criminal law, and applies these principles to a number of key statutory offences such as public order offences and drugs offences which illustrate the process themes above. The impact of public policy and law reform is an important underlying theme. 
Main Topics
Criminalisation, over-criminalisation and defining crimeCriminal process, including police powers and pre-trial processComponents of criminal offences: physical and mental elementsDrugs (NSW only), including harm minimisation policies and incursions into general principles of criminal lawPublic order offenses",This course is strictly for students undertaking Law programs only.,6 Units of Credit
LAWS1022,"Term 2 2019, Term 3 2019","Main Campus, Kensington",1,0,"LAWS1022 is only available in T3 by School Consent. Contact UNSW Law Students Services for more information. 
This course follows from LAWS1021 / JURD 7121 Crime and the Criminal Process, and applies the perspectives and themes of that course to the doctrinally central criminal offences and defences. These are examined in a contextual framework that emphasises the policy and social issues underpinning the development and application of the law. This critical approach allows students to appreciate a complex set of conflicting ideologies, principles, discretion and histories informing the criminal law. The course draws on materials from other disciplines – especially criminology, history, sociology and feminist theory, which enhance students’ appreciation of the law in context. Social issues including race, class and gender are stressed. Comparisons with jurisdictions other than NSW are undertaken where this highlights relevant policy issues, legislative alternatives, or demonstrates the contingent nature of the law in question. Throughout, detailed doctrinal analysis of the chosen offences/defences takes place and students develop the skills of legal element analysis of both statutory and common law offences and defences. 
 Main Topics
HomicideDefences (including mental illness, automatism, self-defence, provocation, substantial impairment, intoxication)Assault (including aggravated assault and domestic violence)Sexual AssaultDishonest AcquisitionExtending Criminal Liability (including complicity)Sentencing",Prerequisite: LAWS1021 or JURD7121 or LAWS1001 or  JURD7101,6 Units of Credit
LAWS1052,Term 1 2019,"Main Campus, Kensington",1,0,"Introducing Law and Justice is the first of the foundational level core courses for the LLB degree. This course introduces students to the history, operation and contemporary dynamics of our legal system. It provides a grounding in the core legal skills necessary for successful study and practice, including legal research and writing; case analysis and critique; and the interpretation and application of statutes. All of these skills will continue to be developed through your LLB studies.
The course has two parts, a Coursework Seminar and a Research Tutorial. All students enrolled in Introducing Law and Justice participate in two Coursework seminars each week, starting in Week 1. And a 1hr per week Research Tutorial, also starting in Week 1. All classes in Introducing Law and Justice are small, with a focus on interactive teaching, so while the topics covered in Coursework seminars and Research tutorials are linked, they do not follow a standard lecture/tutorial model.",This course is strictly for students undertaking Law programs only.,6 Units of Credit
