Course,Term_Offerings,Campus,undergraduate_offered,postgraduate_offered,course_description,pre_requisites,course_uoc
MARK5811,"Term 2 2019, Term 3 2019","Main Campus, Kensington",0,1,"This course offers an overview of the varied forms of marketing research that are used by practicing marketing managers to make informed decisions. Topics include: problem definition and research design, questionnaire design, sampling, interviewing, data analysis, interpretation, and reporting. The course is conducted through the implementation of a ‘live’ project, whereby students work with a client to develop a research proposal, design a questionnaire, collect data and analyse and present the findings of the research. There is an assumed knowledge that students are familiar with basic statistical methods, as they will learn how to use statistical software to analyse data and present findings in their final project. It is strongly recommended that students have had at least one course in statistics prior to enrolling into this course.",Prerequisite or Corequisite: MARK5700 or MARK5800 or MARK5801,6 Units of Credit
MARK5812,Term 2 2019,"Main Campus, Kensington",0,1,"This course presents an integrated approach to distribution strategy, retail channel management, and related aspects of logistics. Distribution involves the creation of product and service availability through marketing channels, retailing involves the management and marketing of assortments of merchandise for direct sale to the consumer, and logistics involves the creation of targeted levels of customer service through the distribution system. Students will examine a) distribution activities involved in getting consumer and business goods and services to market, b) the unique characteristics associated with retail marketing of merchandise assortments, and c) the strategic aspects of logistics as a marketing tool. In marketing management, quality products and good promotion efforts are not enough. Product and service assortments and availability levels must competitively match the wants of target market customers. Logistics decisions in marketing concern setting and managing appropriate levels and allocations of stock, levels of delivery service, and levels of associated physical distribution services to achieve marketing and distribution objectives.",Prerequisite or Corequisite: MARK5700 or MARK5800 or MARK5801,6 Units of Credit
MARK5813,Term 3 2019,"Main Campus, Kensington",0,1,"The development and commercialisation of new products and services is a core business function for most organisations. The purpose of this course is to develop a solid understanding of new product and service development from a strategic marketing and management perspective. The topics cover a) the strategic basis for product development including sources and types of innovation, market entry timing, product market structure and competition, disruptive and entrepreneurial innovation, and the development of new services and service bundles; b) marketing research techniques for new product development including user and lead user analysis, conjoint analysis, and pre-market forecasting; and c) the management of the new product development process including collaboration and networks as well as strategies for launching and marketing new products and services.",Prerequisite or Corequisite: MARK5700 or MARK5800 or MARK5801,6 Units of Credit
MARK5814,Term 2 2019,"Main Campus, Kensington",0,1,"Marketers make considerable use of interactive electronic technologies: the Internet, interactive TV, SMS communications, electronic kiosks, etc. They do so to achieve a variety of goals: information provision, advertising and promotion, building customer profiles, direct and interactive communications, placing goods with customers through virtual stores, and working with customers to develop innovative new products and services. These activities present management with exciting opportunities, reveal new sources of competition, and also demand a re-evaluation of core competencies. Topics include: integrating e-marketing with traditional forms of marketing (such as the use of the Internet alongside radio, magazine and television media), customer service and fulfilment challenges, global connectivity, adaptive and accountable marketing planning, and specific implications for intermediaries and business-to-business marketers.",Prerequisite or Corequisite: MARK5700 or MARK5800 or MARK5801 or MARK5813,6 Units of Credit
MARK5816,Term 2 2019,"Main Campus, Kensington",0,1,"This course focuses on the distinctive characteristics and problems of marketing in service organizations and for any organization developing and marketing services as part of its business portfolio. It demonstrates why and how services require a distinctive approach to marketing strategy-both in its development and in its execution. This course examines cases from commercial and not-for-profit organizations including banking, transportation, hotels, tourism, hospitals, education and professional services such as accountancy, engineering, and management consultancy. Anyone working in a service industry or for an organization with a strong commitment to customer service will find this course relevant.
Exclusion: MARK5941",Prerequisite or Corequisite:MARK5800 or MARK5801 or MARK5813 or enrolment in program 8406,6 Units of Credit
MARK5820,Term 2 2019,"Main Campus, Kensington",0,1,"The course examines the place of a range of  events in the broader economy. It explores the types, purpose, importance (i.e. taxonomy) of events i.e. meetings, conventions, incentives, exhibitions, sporting, cultural other events. It analyses the impacts of event on local and wider community and economy - economic, environmental social/ cultural and political - and the implications of these impacts for sustainable business development. The course emphasises the management and marketing of events through the whole process from the initial idea and feasibility study to post event evaluation.",Prerequisite or corequisite:MARK5800 or MARK5801 or (enrolment in program 7291 or 5291 or 8291 or 8281),6 Units of Credit
MARK5821,Term 3 2019,"Main Campus, Kensington",0,1,"This course is designed to give students a good working knowledge of the many aspects of product and brand management. The separation of the product from the brand and the focus on building and maintaining brand equity has created a need for marketers to understand the complex relationship between products and brands. The material covered in the course includes: the components of Consumer Based Brand Equity (CBBE); the relationship between products and brands; the history of brands; brand audits and brand architecture decisions; understanding brand associations; brand performance measurement; creating, maintaining and measuring brand equity.",Corequisite: MARK5700 or MARK5800,6 Units of Credit
MARK5822,Term 1 2019,"Main Campus, Kensington",0,1,"MARK5822 helps to develop students’ capabilities of using advanced analytical tools to address marketing problems – key skills that numerous companies have stated they look for in marketers, particularly in challenging business environments.
Students are exposed to a range of statistical tools and techniques, from classical statistical tools to emerging big data techniques. The emphasis is not on formulae of statistical tools, but on how to apply and interpret a range of statistical techniques to help answer marketing-related questions.
The course is organised around daily marketing problems. Students are strongly encouraged to start thinking as marketers by asking questions of their data, setting their own direction for the analysis in the project and thinking about how a company could utilise the results in practice.","Prerequisite: COMM5005 or COMM5011 or ECON5248. If students can demonstrate equivalent statistics knowledge, but haven't completed any of the listed pre-requisite courses, they can seek permission from Program Coordinator by submitting an online form.",6 Units of Credit
MARK5824,Term 1 2019,"Main Campus, Kensington",0,1,"A sales force is an integral part of a firm’s total marketing effort. To be effective, salespeople must manage relationships with internal and external customers, relay timely and relevant information between company and customer, and create value.  This course builds on knowledge of basic marketing concepts, to provide students with an understanding of the organisation, planning and measurement of a company’s selling efforts in B2C and B2B contexts.",Prerequisite or Co-requisite: MARK5700,6 Units of Credit
MARK5826,Term 2 2019,"Main Campus, Kensington",0,1,"Today’s data-rich environment and advances in big data analytics have enabled product idea generation from the crowd, innovative “data”-based products or services development and effective marketing of new product ideas on crowdfunding platforms. Now, “data” itself may form part of the “core material” of new products or services. 
This course integrates the principles of product development with big data analytics by covering (1) new product idea generation using natural language processing such as sentiment analysis or topic modelling to analyse social media, product reviews or start-ups on crowdfunding platforms, (2) video ad content analysis for marketing new product ideas on crowdfunding platforms, (3) data product or service development such as book recommendation algorithms, content product (e.g. movie), IoT (Internet-of-Things), and a virtual personal assistant, (4) product attribute optimisation for products with many attributes using efficient survey design and variable selection regression and (5) new product demand forecasting.
Students will exercise hands-on data analytics using Python, and then tackle globally challenging real-world problems by developing new data products. No prior knowledge of Python is needed because this course will go through Python step-by-step.","Pre-requisite: COMM5005 or COMM5011 or ECON5248. If students can demonstrate equivalent statistics knowledge, but haven't completed any of the listed pre-requisite courses, they can seek permission from Program Coordinator by submitting an online form.",6 Units of Credit
MARK5827,Term 3 2019,"Main Campus, Kensington",0,1,"To understand consumers and build up a relationship with customers is the first step of every marketing decision. To be effective, marketing managers should know how to identify what target customers need, where they go for shopping and how to interact with them in a marketplace. This course integrates customer relationship management (CRM) and big data analytics in applications ranging from attracting new consumers, retaining customers, and encouraging referrals to re-inviting infrequent or lost customers using prediction, recommendation, and natural language processing. 
In tutorials and labs, students will exercise hands-on data analytics and then tackle real-world customer problems. No prior knowledge of R is needed because this course will go through R step-by-step.","Pre-requisite: COMM5005 or COMM5011 or ECON5248. If students can demonstrate equivalent statistics knowledge, but haven't completed any of the listed pre-requisite courses, they can seek permission from Program Coordinator by submitting an online form.",6 Units of Credit
MARK5828,Term 1 2019,"Main Campus, Kensington",0,1,"Advertising is one of marketing's key communication activities. In today’s data-rich environment, big data analytics, and information technology have increased the effectiveness of advertising dramatically. 
This course will cover new technologies to (1) reach the customers being targeted, (2) measure the effect of ad, and (3) improve the delivery of ad content. It will also illustrate how the advance of data analytics makes it possible to analyse complex types (i.e. picture ad, video ad) of ad content using text, speech, picture, and video analytics. 
Students will exercise hands-on data analytics and then tackle real-world advertising problems. No prior knowledge of Python is needed because this course will go through Python step-by-step.",No Prerequisites,6 Units of Credit
MARK6101,Term 1 2019,"Main Campus, Kensington",0,1,"Participants are equipped with the business skills and techniques necessary to operate in marketing. There are three modules to the course: (a) Market opportunity analysis. Considered are basic types of quantitative and qualitative data for assisting in marketing analysis, environmental scanning, opportunity analysis, forecasting and decision-making. (b) Marketing due diligence. Dealt with in this module are brand assets, trademarks, intangibles, intellectual property, trade practices, compliance and ethics. (c) Marketing performance analysis. Themes include: customer costs and profitability analysis, measuring marketing assets (brand equity, customer satisfaction), measuring ROI of marketing programs (eg ""real time"" metrics for mid-program corrections versus detailed ""report cards"" at the end of the program), measuring promotion and advertising effectiveness. For managers to assess and demonstrate the impact of investments in marketing, they need accurate measurement tools and systems that link non-financial measures (such as customer satisfaction, brand equity, market orientation, and market share) to the financial measures used by CEOs and CFOs.Exclusion: MARK5932, Mark6001",Prerequisite: MARK5700 or MARK5800,6 Units of Credit
MARK6102,Term 2 2019,"Main Campus, Kensington",0,1,"Creativity and innovation are the key drivers of success for many of today’s leading companies. Some of the most dramatic gains in shareholder value over the last few years (e.g. Google and Apple) have been created by the culture of creative innovation. Indeed, a culture of creativity and innovation is commonly recognised as the only sustainable competitive advantage. This course will focus on developing new ways of thinking and will discuss in depth the intricacies of innovation, customer experience, solution development and the problems faced by managers in this area. The course provides many opportunities to apply these new ways of thinking through class exercises and the course project, where students will develop creative concepts for an assigned topic. Active participation in this course will provide students with the opportunity to gain practical, real world experience in the application of different tools and approaches such as Human Centred Design (HCD), Ten types of innovation, Crowdsourcing innovation, Lean Start up, and others. The project will follow the phases of human centred design (HCD) to synthesise real-time research, approach ideation and investigation on parallel tracks. Teams will present their work at the end of term and vote on each other’s presentations. 
Exclusion: MARK6002",Prerequisite: MARK5700 or MARK5800,6 Units of Credit
MARK6105,Term 1 2019,"Main Campus, Kensington",0,1,"The strategic management of customer relationships is a critical activity for all enterprises. The means of effectively managing relationships with customers is addressed under the headings of relationship marketing and customer relationship management (CRM). Over the last two decades, relationship marketing has become an increasingly important topic. Organisations have learned that building relationships and sustaining them is usually more important than activities focused on customer acquisition. This course first examines the key principles of relationship marketing including: the shift from a functional to a cross functional orientation; the emphasis on business processes; the integration of customer service and quality with marketing; trust, commitment, satisfaction and loyalty as building blocks of relationships; the drivers and scope of relationships, and a focus on multiple stakeholders beyond the enterprise-customer relationship. The course then addresses customer relationship management, which involves an enterprise-wide customer-centric approach to maximising customer value. It is aimed at creating long-lasting and profitable relationships with individual customers - in both B2B and B2C contexts. Developments in technology have allowed organizations to look at their customers as individuals and to gather, store and analyse customer-based information. An outcome is an increase in the use of direct marketing techniques such as those for designing and managing consumer databases and customer service centres. Topics include: CRM strategy development; value creation through CRM; multichannel integration; information and technology management; and CRM performance assessment. Participants will be exposed to a range of relationship-building strategies and techniques, as well as software and CRM technologies. Exclusions: MARK5985, MARK6006",Prerequisite: MARK5700 or MARK5800,6 Units of Credit
MARK6110,Term 3 2019,"Main Campus, Kensington",0,1,"This is a specialist course that focuses on advanced marketing strategy and strategic customer management. It integrates knowledge of market and competitor analysis with strategic business considerations, to achieve superior performance in sales growth, market share and profit contribution. Topics include: organisational strategy; strategic marketing planning; value proposition development; defensive strategies; competitive and life-cycle strategies at the level of the business unit; marketing portfolio analysis, diversification and differentiation; social, ethical, technological and global issues as they impact on marketing performance. The course will include topics that will assist managers to manage and segment their market appropriately, to identify target markets, and to best reach those markets. Topics include: strategic customer management, key frameworks in strategic marketing, key concepts in marketing relationships, value proposition deconstruction, acquisition and retention strategies, co-creation strategy, stakeholder management, customer relationships, performance assessments, and integrating corporate strategy, business unit strategy and marketing strategy. This is an advanced marketing course with an emphasis on techniques to help market managers understand marketing from a strategic perspective.
Exclusions: MARK6017, MARK6024",Prerequisite: MARK5700 or MARK5800,6 Units of Credit
MARK6111,Term 3 2019,"Main Campus, Kensington",0,1,"Globalisation is the process by which firms operate on a global basis, organising their structure, capabilities resources and people in such a way as to address the world as a single market. It is natural however that marketing practices will vary from country to country, and culture, economic and social circumstances, and societal infrastructure are different. These differences mean that a successful marketing approach in one country will not automatically work in another country. Customer preferences, competition, distribution channels and communications media differ. Global marketing requires marketers to behave in ways that are global and local at the same time by responding to similarities and differences in various markets. An important task in global marketing is learning to recognize the extent to which marketing plans and programs might be standardised worldwide as well as the extent to which they need to be adapted. The decision to enter markets outside the home country depends on a firm's resources, managerial attitudes, and the nature and extent of opportunities and threats. This gives rise to important themes in international marketing: market entry, partnering and strategic alliances, managing across borders, grey markets - these are some of the key issues dealt with in this course.",Prerequisite: MARK5700 or MARK5800,6 Units of Credit
MARK8992,Term 1 2019,"Main Campus, Kensington",0,0,N\A,N\A,N\A
MARK8995,Term 3 2019,"Main Campus, Kensington",0,1,N\A,N\A,N\A
MARK8996,Term 1 2019,"Main Campus, Kensington",0,1,N\A,N\A,N\A
MATH1011,"Term 1 2019, Term 3 2019","Main Campus, Kensington",1,0,"Functions (and their inverses), limits, asymptotes, continuity; differentiation and applications; integration, the definite integral and applications; inverse trigonometric functions; the logarithmic and exponential functions and applications; sequences and series; mathematical induction; the binomial theorem and applications; introduction to probability theory; introduction to 3-dimensional geometry; introduction to linear algebra.
Assumed knowledge: A level of knowledge equivalent to achieving a mark of at least 60 in HSC Mathematics. Students who have taken General Mathematics will not have achieved the level of knowledge which is assumed in this course.
Note: This course is not intended for students who propose to study a substantial amount of Mathematics beyond first year level. Many later year courses in Mathematics have completion of MATH1231, MATH1241 or MATH1251 as a prerequisite. This course can be taken as a preparatory course by students who need to take MATH1131 but do not meet the assumed knowledge requirement. 
This course is not available as a General Education Course or as an Elective where students have met the Maths assumed knowledge of Mathematics and Mathematics Extension 1.",Exclusion: Not enrolled in 3991 or any UNSW Business Program,6 Units of Credit
MATH1031,"Term 1 2019, Term 3 2019","Main Campus, Kensington",1,0,"MATH1031 will provide you with a good knowledge of topics in Calculus and Linear Algebra and show applications in interdisciplinary contexts through lectures, videos and exercises. It will enhance your skills in analytical thinking and problem solving through illustrative examples in lectures, problem based tutorials and an assignment. The course will also engage you in independent and reflective learning through your independent mastery of tutorial problems and Maple. The mathematical skills that you will develop are generic problem solving skills, based on logical arguments that can be applied in multidisciplinary work. You will be encouraged to develop your communication skills through active participation in tutorials, and by writing clear and logical arguments in the assignment and when solving tutorial problems.
Note: This course is not intended for students who propose to study a substantial amount of Mathematics beyond first year level. Many later year courses in Mathematics have completion of MATH1231, MATH1241 or MATH1251 as a prerequisite. This course can be taken as a preparatory course by students who need to take MATH1131 but do not meet the assumed knowledge requirement.",No Prerequisites,6 Units of Credit
MATH1041,"Term 1 2019, Term 2 2019, Term 3 2019","Main Campus, Kensington",1,0,"Probability, random variables, independence. Discrete distributions, Poisson and binomial distributions. Data analysis, Descriptive statistics. Sampling, Continuous distributions, the normal distribution. Estimation of mean and variance. Tests of hypotheses. Linear regression and correlation.  Tests for goodness of fit. Bayesian statistics.  Assumed knowledge: As for MATH1031Note: This course is not intended for students who propose to study a substantial amount of Mathematics beyond first year level. Many later year courses in Mathematics have completion of MATH1231, MATH1241 or MATH1251 as a prerequisite.",Excluded: MATH2841,6 Units of Credit
MATH1081,"Term 1 2019, Term 2 2019, Term 3 2019","Main Campus, Kensington",1,0,"Role of proof in mathematics, logical reasoning and implication, different types of proofs. Sets, algebra of sets, operations on sets. Mathematical logic, truth tables, syntax, induction. Graphs and directed graphs, basic graph algorithms. Counting, combinatorial identities, binomial and multinomial theorems. Binary operations and their properties, ordered structures. Recursion relations. Assumed knowledge: HSC Mathematics Extension 1. Students will be expected to have achieved a combined mark of at least 100 in Mathematics and Mathematics Extension 1.",Corequisite: MATH1131 or MATH1141 or MATH1151.,6 Units of Credit
MATH1099,"Term 2 2019, Term 3 2019","Main Campus, Kensington",1,0,"This course provides scholars with a practical application of the fundamental principles of mathematics in an industry environment.
Note: Only available to UNSW Advanced Mathematics (Honours) and Data Science Co-op Scholars. 
There is no fee liability for Advanced Maths Co-Op or Data Science students.",Co-Op Scholar enrolled in 3956 or 3959,12 Units of Credit
MATH1131,"Term 1 2019, Term 2 2019, Term 3 2019","Main Campus, Kensington",1,0,"Complex numbers, vectors and vector geometry, linear equations, matrices and matrix algebra, determinants. Functions, limits, continuity and differentiability, integration, polar coordinates, logarithms and exponentials, hyperbolic functions. Introduction to computing and the Maple symbolic algebra package.   Assumed knowledge: HSC Mathematics Extension 1. Students will be expected to have achieved a combined mark of at least 100 in Mathematics and Mathematics Extension 1.",No Prerequisites,6 Units of Credit
MATH1141,"Term 1 2019, Term 3 2019","Main Campus, Kensington",1,0,As for MATH1131 but in greater depth. Assumed knowledge:  Students will be expected to have achieved a combined HSC mark in Mathematics Extension 1 and 2 over 175.,No Prerequisites,6 Units of Credit
